{"$schema":"https://json-schema.org/draft/2020-12/schema","$id":"https://mcf.local/schemas/mcf-multi-ai-continuity-v1.schema.json","title":"MCF Multi-AI Continuity V1.2","type":"object","additionalProperties":false,"required":["protocol","evaluation_id","governance_states","evidence_states","bootstrap","checkpoints","observations","result","evidence","publication"],"properties":{"protocol":{"const":"MCF-MULTI-AI-CONTINUITY-V1.2"},"evaluation_id":{"$ref":"#/$defs/evaluationId"},"governance_states":{"type":"array","minItems":4,"maxItems":4,"uniqueItems":true,"prefixItems":[{"const":"NOT_AUTHORIZED"},{"const":"AUTHORIZED"},{"const":"CANONICALIZATION_PENDING"},{"const":"CANONICAL"}],"items":false},"evidence_states":{"type":"array","minItems":5,"maxItems":5,"uniqueItems":true,"prefixItems":[{"const":"UNVERIFIED"},{"const":"IN_PROGRESS"},{"const":"PASS"},{"const":"FAIL"},{"const":"STALE"}],"items":false},"bootstrap":{"type":"array","minItems":9,"maxItems":9,"uniqueItems":true,"prefixItems":[{"const":"identify project"},{"const":"locate registry"},{"const":"read project capsule"},{"const":"read canonical entrypoints"},{"const":"inspect open work"},{"const":"re-observe live state when required"},{"const":"detect stale/conflict"},{"const":"open mission contract"},{"const":"continue from next executable gate"}],"items":false},"checkpoints":{"type":"array","minItems":7,"maxItems":7,"uniqueItems":true,"prefixItems":[{"const":"material decision"},{"const":"critical FAIL"},{"const":"direction change"},{"const":"gate"},{"const":"external dependency"},{"const":"conflict"},{"const":"mission close"}],"items":false},"observations":{"type":"array","minItems":2,"uniqueItems":true,"items":{"$ref":"#/$defs/observation"}},"result":{"$ref":"#/$defs/derivedResult"},"evidence":{"$ref":"#/$defs/evidenceEvaluation"},"publication":{"$ref":"#/$defs/publication"}},"$defs":{"governanceState":{"type":"string","enum":["NOT_AUTHORIZED","AUTHORIZED","CANONICALIZATION_PENDING","CANONICAL"]},"evidenceState":{"type":"string","enum":["UNVERIFIED","IN_PROGRESS","PASS","FAIL","STALE"]},"bootstrapStep":{"type":"string","enum":["identify project","locate registry","read project capsule","read canonical entrypoints","inspect open work","re-observe live state when required","detect stale/conflict","open mission contract","continue from next executable gate"]},"checkpointClass":{"type":"string","enum":["material decision","critical FAIL","direction change","gate","external dependency","conflict","mission close"]},"evaluationId":{"type":"string","minLength":1,"pattern":"\\S","readOnly":true},"observationId":{"type":"string","minLength":1,"pattern":"\\S","readOnly":true},"sourceKind":{"type":"string","enum":["remote-git","local-repository","runtime-probe","registry-document","open-work","remote-head"]},"timingPolicy":{"type":"string","enum":["DURABLE","SNAPSHOT","LIVE_REQUIRED","FRESH_ON_ATTEMPT"]},"nonEmptyString":{"type":"string","minLength":1,"pattern":"\\S"},"observation":{"type":"object","additionalProperties":false,"required":["observation_id","evaluation_id","source_kind","timing_policy","timestamp","fresh","reused"],"properties":{"observation_id":{"$ref":"#/$defs/observationId"},"evaluation_id":{"$ref":"#/$defs/evaluationId"},"source_kind":{"$ref":"#/$defs/sourceKind"},"timing_policy":{"$ref":"#/$defs/timingPolicy"},"timestamp":{"$ref":"#/$defs/nonEmptyString"},"fresh":{"type":"boolean"},"reused":{"type":"boolean"},"head":{"$ref":"#/$defs/nonEmptyString"}},"allOf":[{"if":{"properties":{"source_kind":{"const":"remote-head"}},"required":["source_kind"]},"then":{"required":["head"]}}]},"derivedResult":{"type":"object","additionalProperties":false,"required":["evaluation_id","evaluator_version","operand_ids"],"properties":{"evaluation_id":{"$ref":"#/$defs/evaluationId"},"evaluator_version":{"$ref":"#/$defs/nonEmptyString"},"operand_ids":{"type":"array","minItems":1,"uniqueItems":true,"items":{"$ref":"#/$defs/observationId"}}}},"evidenceBinding":{"type":"object","additionalProperties":false,"required":["dimension","applicable","current","evaluation_id","result"],"properties":{"dimension":{"$ref":"#/$defs/nonEmptyString"},"applicable":{"type":"boolean"},"current":{"type":"boolean"},"evaluation_id":{"$ref":"#/$defs/evaluationId"},"result":{"enum":["MATCH","MISMATCH"]}}},"evidenceEvaluation":{"type":"object","additionalProperties":false,"required":["evaluation_id","required_dimensions","bindings","state"],"properties":{"evaluation_id":{"$ref":"#/$defs/evaluationId"},"required_dimensions":{"type":"array","minItems":1,"uniqueItems":true,"items":{"$ref":"#/$defs/nonEmptyString"}},"bindings":{"type":"array","minItems":1,"items":{"$ref":"#/$defs/evidenceBinding"}},"state":{"$ref":"#/$defs/evidenceState"}}},"domainScope":{"type":"array","minItems":1,"uniqueItems":true,"items":{"type":"string","minLength":1,"pattern":"\\S"}},"fileScope":{"type":"array","minItems":1,"uniqueItems":true,"items":{"type":"string","minLength":1,"pattern":"^(?![A-Za-z]:)(?!/)(?!.*[\\u0000-\\u001F\\u007F])(?=.*\\S).+$"}},"domainScopes":{"type":"object","additionalProperties":false,"required":["candidate","concurrent"],"properties":{"candidate":{"$ref":"#/$defs/domainScope"},"concurrent":{"$ref":"#/$defs/domainScope"}}},"fileScopes":{"type":"object","additionalProperties":false,"required":["candidate","concurrent"],"properties":{"candidate":{"$ref":"#/$defs/fileScope"},"concurrent":{"$ref":"#/$defs/fileScope"}}},"publication":{"type":"object","additionalProperties":false,"required":["evaluation_id","remote_head_observation_id","open_work_observation_id","relation","base","domain_scopes","file_scopes","prior_publication_history"],"properties":{"evaluation_id":{"$ref":"#/$defs/evaluationId"},"remote_head_observation_id":{"$ref":"#/$defs/observationId"},"open_work_observation_id":{"$ref":"#/$defs/observationId"},"relation":{"const":"EQUAL"},"base":{"$ref":"#/$defs/nonEmptyString"},"domain_scopes":{"$ref":"#/$defs/domainScopes"},"file_scopes":{"$ref":"#/$defs/fileScopes"},"prior_publication_history":{"$ref":"#/$defs/priorPublicationHistory"}}},"priorPublicationHistory":{"type":"object","additionalProperties":false,"required":["complete","observation_ids"],"properties":{"complete":{"const":true},"observation_ids":{"type":"array","uniqueItems":true,"items":{"$ref":"#/$defs/observationId"}}}}}}
