{"protocol":"MCF-MULTI-AI-CONTINUITY-V1.2","evaluation_id":"E1","governance_states":["NOT_AUTHORIZED","AUTHORIZED","CANONICALIZATION_PENDING","CANONICAL"],"evidence_states":["UNVERIFIED","IN_PROGRESS","PASS","FAIL","STALE"],"bootstrap":["identify project","locate registry","read project capsule","read canonical entrypoints","inspect open work","re-observe live state when required","detect stale/conflict","open mission contract","continue from next executable gate"],"checkpoints":["material decision","critical FAIL","direction change","gate","external dependency","conflict","mission close"],"observations":[{"observation_id":"R1","evaluation_id":"E1","source_kind":"remote-head","timing_policy":"FRESH_ON_ATTEMPT","timestamp":"2026-09-07T00:00:00Z","fresh":true,"reused":false,"head":"abc123"},{"observation_id":"O1","evaluation_id":"E1","source_kind":"open-work","timing_policy":"FRESH_ON_ATTEMPT","timestamp":"2026-09-07T00:00:00Z","fresh":true,"reused":false}],"result":{"evaluation_id":"E1","evaluator_version":"v1","operand_ids":["R1","O1"]},"evidence":{"evaluation_id":"E1","required_dimensions":["truth","scope"],"bindings":[{"dimension":"truth","applicable":true,"current":true,"evaluation_id":"E1","result":"MATCH"},{"dimension":"scope","applicable":true,"current":true,"evaluation_id":"E1","result":"MATCH"}],"state":"PASS"},"publication":{"evaluation_id":"E1","remote_head_observation_id":"R1","open_work_observation_id":"O1","relation":"EQUAL","base":"abc123","domain_scopes":{"candidate":["continuity"],"concurrent":["project-technical-truth"]},"file_scopes":{"candidate":["schemas/mcf-multi-ai-continuity-v1.schema.json"],"concurrent":["docs/protocols/project.md"]},"prior_publication_history":{"complete":true,"observation_ids":[]}}}
